{
  "schema_version": 1,
  "benchmark_suite_version": "v1.0",
  "status": "complete",
  "date": "2026-07-15",
  "environment": {
    "gpu": "NVIDIA GeForce RTX 5070 Laptop GPU",
    "driver": "592.01",
    "os": "Windows-10-10.0.26200-SP0",
    "python": "3.10.20",
    "pytorch": "2.12.1+cu130",
    "cuda_runtime": "13.0",
    "gsplat_version": "1.4.0+pt21cu118",
    "gpu_clocks_locked": false,
    "gsplat_extension_dir": "C:\\Users\\36570\\3dgs-renderer-benchmark\\results\\task_b_gsplat_build\\gsplat_cuda",
    "gsplat_source_dir": "C:\\Users\\36570\\Documents\\Codex\\2026-07-13\\zhe\\sources\\gsplat",
    "gsplat_scene_extension_dir": "C:\\Users\\36570\\AppData\\Local\\torch_extensions\\torch_extensions\\Cache\\py310_cu130\\gsplat_scene_cuda",
    "gsplat_inference_extension_dir": "C:\\Users\\36570\\AppData\\Local\\torch_extensions\\torch_extensions\\Cache\\py310_cu130\\experimental_gaussian_render_inference_scene_cuda"
  },
  "protocol": {
    "resolution": [
      1280,
      720
    ],
    "resolution_name": "720p",
    "warmup_frames": 10,
    "measured_frames_per_repeat": 30,
    "repeats": 3,
    "total_measured_frames": 90,
    "timing": "torch.cuda.Event elapsed time; per-frame synchronization"
  },
  "scene": {
    "scene_id": "bicycle",
    "dataset_family": "Mip-NeRF 360",
    "model_path": "C:\\Users\\36570\\3dgs-renderer-benchmark\\data\\official\\mipnerf360\\bicycle\\point_cloud.ply",
    "model_sha256": "64d357cb25bd85f710f8551a18d830f8497277fbd8c5805adfd72ffe9ca78227",
    "camera_path": "C:\\Users\\36570\\3dgs-renderer-benchmark\\data\\official\\mipnerf360\\bicycle\\cameras.json",
    "camera_sha256": "5f0ebcb6b33e415061a485ed9961fb277cf7e875586f0d82d88b746d9d9fd502",
    "num_gaussians": 6131954
  },
  "results": {
    "gsplat_higs_auto": {
      "renderer": "gsplat_higs_auto",
      "renderer_implementation": "nerfstudio-project/gsplat experimental HiGS auto (tile 8, SH 32b)",
      "renderer_version": "1.5.3",
      "renderer_source_url": "https://github.com/nerfstudio-project/gsplat",
      "renderer_commit_hash": null,
      "timing_method": "torch.cuda.Event elapsed time; per-frame synchronization",
      "benchmark_suite_version": "v1.0",
      "benchmark_commit_hash": "5953bd1c6b232bb347094cd641fec4f93018be57",
      "driver_version": null,
      "cuda_version": "13.0",
      "hardware_metadata": {
        "cuda_available": true,
        "gpu_name": "NVIDIA GeForce RTX 5070 Laptop GPU",
        "compute_capability": "12.0",
        "total_vram_mb": 8150.6,
        "multi_processor_count": 36
      },
      "mean_wall_latency_ms": 3.9582222222222225,
      "median_wall_latency_ms": 3.885,
      "wall_fps": 252.6,
      "mean_fps": 255.6,
      "mean_latency_ms": 3.9128888888888893,
      "median_latency_ms": 3.86,
      "min_latency_ms": 3.3,
      "max_latency_ms": 5.96,
      "std_latency_ms": 0.469851618290154,
      "coefficient_of_variation": 0.12007793516047778,
      "stability_score": 0.7721853244778748,
      "jitter_pct": 12.01,
      "p1_latency_ms": 3.3,
      "p1_fps": 303.0,
      "p5_latency_ms": 3.3445,
      "p5_fps": 299.0,
      "p10_latency_ms": 3.39,
      "p10_fps": 295.0,
      "p25_latency_ms": 3.56,
      "p25_fps": 280.9,
      "p75_latency_ms": 4.095,
      "p75_fps": 244.2,
      "p90_latency_ms": 4.591,
      "p90_fps": 217.8,
      "p95_latency_ms": 4.6655,
      "p95_fps": 214.3,
      "p99_latency_ms": 4.998799999999999,
      "p99_fps": 200.0,
      "num_frames": 90,
      "warmup_frames": 10,
      "measured_frames_per_repeat": 30,
      "repeats": 3,
      "image_width": 1280,
      "image_height": 720,
      "num_gaussians": 6131954,
      "gpu": "NVIDIA GeForce RTX 5070 Laptop GPU",
      "peak_vram_mb": 2744.0,
      "avg_vram_mb": 2700.6,
      "scene_load_time_ms": 5632.95,
      "scene_parse_time_ms": 0.0,
      "file_size_mb": 1450.28,
      "quality_status": "not_measured",
      "quality_reference": null,
      "psnr": null,
      "ssim": null,
      "lpips": null,
      "quality_factor": null,
      "effective_fps": null,
      "quality_adjustment": null,
      "benchmark_type": "real_scene_speed",
      "difficulty_score": null,
      "difficulty_formula": null,
      "difficulty_inputs": null,
      "difficulty_normalization": null,
      "frame_times_ms": [
        4.52,
        4.59,
        4.41,
        4.05,
        3.88,
        4.1,
        4.28,
        4.03,
        3.86,
        3.73,
        3.64,
        4.03,
        3.94,
        3.91,
        3.56,
        3.34,
        3.62,
        3.77,
        3.72,
        3.54,
        3.42,
        3.44,
        3.66,
        3.34,
        3.5,
        4.08,
        4.88,
        3.51,
        4.66,
        3.35,
        4.66,
        4.59,
        4.44,
        3.98,
        3.86,
        4.11,
        4.33,
        4.0,
        3.83,
        3.71,
        3.57,
        3.94,
        3.86,
        3.87,
        3.77,
        3.39,
        3.64,
        3.78,
        3.74,
        3.56,
        3.53,
        3.45,
        3.68,
        3.33,
        3.46,
        4.05,
        4.84,
        3.53,
        4.6,
        3.3,
        4.49,
        4.56,
        4.43,
        5.96,
        3.94,
        4.16,
        4.67,
        4.03,
        3.86,
        3.74,
        4.33,
        3.95,
        3.87,
        3.94,
        3.57,
        3.35,
        3.62,
        3.79,
        3.87,
        3.5,
        3.39,
        3.44,
        3.72,
        3.36,
        3.46,
        4.08,
        4.81,
        3.59,
        4.62,
        3.3
      ],
      "wall_frame_times_ms": [
        5.04,
        4.62,
        4.44,
        4.09,
        3.91,
        4.13,
        4.32,
        4.06,
        3.89,
        3.76,
        3.69,
        4.08,
        4.0,
        3.94,
        3.59,
        3.37,
        3.65,
        3.8,
        3.75,
        3.57,
        3.45,
        3.47,
        3.69,
        3.39,
        3.55,
        4.12,
        4.91,
        3.57,
        4.71,
        3.39,
        4.77,
        4.63,
        4.47,
        4.02,
        3.89,
        4.14,
        4.36,
        4.04,
        3.86,
        3.74,
        3.6,
        3.96,
        3.88,
        3.93,
        3.87,
        3.44,
        3.69,
        3.81,
        3.78,
        3.64,
        3.61,
        3.5,
        3.71,
        3.36,
        3.49,
        4.08,
        4.87,
        3.56,
        4.64,
        3.33,
        4.55,
        4.59,
        4.48,
        6.02,
        3.99,
        4.19,
        4.7,
        4.07,
        3.9,
        3.77,
        4.36,
        3.98,
        3.9,
        3.97,
        3.6,
        3.38,
        3.65,
        3.82,
        3.9,
        3.66,
        3.42,
        3.47,
        3.75,
        3.38,
        3.49,
        4.1,
        4.88,
        3.64,
        4.67,
        3.34
      ]
    },
    "speedy_splat": {
      "renderer": "speedy_splat",
      "renderer_implementation": "j-alex-hanson/speedy-splat",
      "renderer_version": "unknown",
      "renderer_source_url": "https://github.com/j-alex-hanson/speedy-splat",
      "renderer_commit_hash": null,
      "timing_method": "torch.cuda.Event elapsed time; per-frame synchronization",
      "benchmark_suite_version": "v1.0",
      "benchmark_commit_hash": "5953bd1c6b232bb347094cd641fec4f93018be57",
      "driver_version": null,
      "cuda_version": "13.0",
      "hardware_metadata": {
        "cuda_available": true,
        "gpu_name": "NVIDIA GeForce RTX 5070 Laptop GPU",
        "compute_capability": "12.0",
        "total_vram_mb": 8150.6,
        "multi_processor_count": 36
      },
      "mean_wall_latency_ms": 13.168000000000001,
      "median_wall_latency_ms": 12.75,
      "wall_fps": 75.9,
      "mean_fps": 76.2,
      "mean_latency_ms": 13.131222222222224,
      "median_latency_ms": 12.72,
      "min_latency_ms": 10.61,
      "max_latency_ms": 17.0,
      "std_latency_ms": 1.6180302344227604,
      "coefficient_of_variation": 0.12322007860658517,
      "stability_score": 0.7679350877510731,
      "jitter_pct": 12.32,
      "p1_latency_ms": 10.6634,
      "p1_fps": 93.8,
      "p5_latency_ms": 10.903500000000001,
      "p5_fps": 91.7,
      "p10_latency_ms": 11.277,
      "p10_fps": 88.7,
      "p25_latency_ms": 11.865,
      "p25_fps": 84.3,
      "p75_latency_ms": 14.525,
      "p75_fps": 68.8,
      "p90_latency_ms": 15.366000000000001,
      "p90_fps": 65.1,
      "p95_latency_ms": 16.03,
      "p95_fps": 62.4,
      "p99_latency_ms": 16.5639,
      "p99_fps": 60.4,
      "num_frames": 90,
      "warmup_frames": 10,
      "measured_frames_per_repeat": 30,
      "repeats": 3,
      "image_width": 1280,
      "image_height": 720,
      "num_gaussians": 6131954,
      "gpu": "NVIDIA GeForce RTX 5070 Laptop GPU",
      "peak_vram_mb": 3522.1,
      "avg_vram_mb": 2865.6,
      "scene_load_time_ms": 5632.95,
      "scene_parse_time_ms": 0.0,
      "file_size_mb": 1450.28,
      "quality_status": "not_measured",
      "quality_reference": null,
      "psnr": null,
      "ssim": null,
      "lpips": null,
      "quality_factor": null,
      "effective_fps": null,
      "quality_adjustment": null,
      "benchmark_type": "real_scene_speed",
      "difficulty_score": null,
      "difficulty_formula": null,
      "difficulty_inputs": null,
      "difficulty_normalization": null,
      "frame_times_ms": [
        15.35,
        16.14,
        14.64,
        14.28,
        14.25,
        14.93,
        14.27,
        13.29,
        12.25,
        11.88,
        12.72,
        12.61,
        12.82,
        12.72,
        11.5,
        10.83,
        12.98,
        13.12,
        12.27,
        11.53,
        11.12,
        11.25,
        13.17,
        12.5,
        11.28,
        14.92,
        17.0,
        11.6,
        16.26,
        10.67,
        16.51,
        15.1,
        14.6,
        13.01,
        12.74,
        15.51,
        15.92,
        13.5,
        12.32,
        11.86,
        12.09,